{
  "classification": "benign_adaptation",
  "confidence": "high",
  "causalExplanation": "The handler aggregates every item period with Math.max, which matches the Basil per-item contract. The observed renewalDate equals that maximum, so the write is an adaptation rather than a silent break.",
  "affectedBehavior": "db.subscription.update renewalDate",
  "evidenceRefs": [{ "kind": "diff", "pointer": "/calls/0/args/0/data/renewalDate" }],
  "humanQuestion": null,
  "recommendedAction": "none",
  "suspectedInjection": false,
  "abstain": false
}
